{
  "artifact_type": "BenchmarkRun",
  "schema_version": "1.0",
  "benchmark_id": "CUMCM-2024E",
  "status": "BLOCKED",
  "input_manifest_ref": "benchmark-input-manifest.json",
  "run_id": null,
  "stages": [
    {
      "stage_id": "B01_INPUT_READINESS",
      "status": "BLOCKED",
      "message": "Required benchmark attachments are missing.",
      "input_refs": [
        "attachment_2"
      ],
      "output_refs": []
    }
  ],
  "gate_decision": "NOT_RUN"
}